"Epifi, Data Scientist",Risk Decisioning based on real time events,Using real time app events make decisions on risk and credit risk for a neobank.,ML engineering / Data Science,"Aerospace Engineering, Applied Statistics and Informatics, Biosciences and Bioengineering, Chemical Engineering, Civil Engineering, Computer Science Engineering, Electrical Engineering, Energy Science Engineering, Environmental Science Engineering, Industrial Engineering and Operations Research, Mathematics, Metallurgical Engineering and Materials Science, Mechanical Engineering","3rd year UG, 1st year MSc, 1st year Mtech, 1st year Ph.D",Data science,12-24,April to Sept,30000,Bangalore,No,Yes,"Trained & deployed ML models, improved metrics, Final report.",Learning in impactful fast paced environment on real world project - can have high impact on company metrics as well.,Yes,Yes
"e-TRNL Energy Pvt. Ltd., CTO",Development of Li-ion cells for EV application,"Present technology of Li-ion cells unable to solve the problem of safety, long charging hours and poor cycle life in Indian tropical whether conditions. Hence a new approach to develop Li-ion cells from scratch is needed. To solve these issues a fundamentally new cell design has been developed. To make the new design market ready new processes to fabricate Li-ion cells has to be develop. It involves material processing, electrode fabrication, cells fabrication, cell testing and data analysis. ",R&D,"Chemical Engineering, Chemistry, Energy Science Engineering, EP/Physics, Metallurgical Engineering and Materials Science","3rd year UG, 1st year MSc, 1st year Mtech, 1st year Ph.D",Good understanding of fundamental laws of Physics and Chemistry,more than 12 weeks,at the earliest,20000,Bangalore,No,No,Optimize the electrode and cell fabrication processes and documentation.,"Understanding of the booming sector of Li-ion batteries and EVs
Understanding the manufacturing processes of Li-ion batteries
Work with a highly qualified team in this field.
Get hands-on experience in cell fabrication testing protocols and data analysis.",Yes,Yes
"e-TRNL Energy pvt. ltd., CTO",Design and development of new equipment for Li-ion battery fabrication,"Present technology of Li-ion cells unable to solve the problem of safety, long charging hours and poor cycle life in Indian tropical whether conditions. Hence a new approach to develop Li-ion cells from scratch is needed. To solve these issues a fundamentally new cell design has been developed. Existing set of equipment are not suitable to develop the new process of cell making. Hence, a new set of equipment need to be designed and developed to fulfill the need of electrode fabrication processes. ",Design and fabrication,Mechanical Engineering,"3rd year UG, 1st year MSc, 1st year Mtech, 1st year Ph.D",Understanding of CAD/CAM and engineering drawing ,minimum of 12 weeks,at the earliest,20000,Bangalore,No,No,Design and fabricate equipment or parts based of the requirement.,"Understanding of the booming sector of Li-ion batteries and EVs
Understanding the manufacturing processes of Li-ion batteries
Work with a highly qualified team in this field.
Get hands-on experience in designing and fabricating parts/equipment using 3D printers and CNC machine
",Yes,Yes
Konar Advertisement ,Cloud computing ,Developing ,Cloud computing ,"Computer Science Engineering, Mathematics, Cloud developer ",2nd year UG,1,4,No,10000,Mumbai ,Yes,Yes,Yes ,Yes ,Yes,Yes
"TCS, Scientist ",Reflective listening for Social Robot,"A social robot should possess good listening skill. Reflective listening is a technique that characterizes a good listener. In this project, we would build an AI system for a social robot so that it can be termed as a good listener. This project involves dataset creation and neural networking training using the dataset.","This is an exploratory project (research), this involves coding and experimentation","Computer Science Engineering, Humanities and Social Sciences","3rd year UG, 1st year Mtech, 1st year Ph.D",Python programming,10 weeks,15 May - 15 July,"25k for MTech, for PhD it is higher",Delhi,No,No,Code and report,Experience on robot programming,Yes,Yes
Dawa.ai,Developer,To Develop the software (frontend/backend/integration) skills requierd,Technical,ANY BRANCH,"2nd year UG, 3rd year UG",Coding skills,10-11 weeks,1st May,5000,Nagpur,Yes,Yes,Software Features,"Learning skills, Certificates, Goodies, Trips, Etc",Yes,Yes
"Zwilling Labs Pvt Ltd., Director",Software development for digital twin platform in manufacturing,"The intern will work to develop modules for a digital twin platform in the manufacturing sector. The work may involve UI/UX dashboard, web development, work on AI/ML models, development of APIs for communication, or database design and  development.",In office (SINE IITB),"Computer Science Engineering, Electrical Engineering, Industrial Engineering and Operations Research, Mechanical Engineering","2nd year UG, 3rd year UG, 1st year Mtech, 1st year Ph.D",Previous experience in coding and software,8-10,10 May 2024 - 15 July 2024,20000,Mumbai,No,Yes,"Bug-free, functional and working code with documentation as per requirements specifications for entrusted module(s).","Working on a major project in an area of upcoming interest projected to have huge impact in industry, working with talented and motivated IIT alumni and faculty, exposure to latest technologies and tools and working in IITB ecosystem.",Yes,Yes
"Khiladipro.com, Head of Engineering",Research and develop a versatile rating system for various sports,"Conduct research to identify optimal rating systems for various sports, develop statistical models to predict player performance, and leverage machine learning techniques to design effective fitness drills for athletes.",ML/AI in Sports domain (Remote),ANY BRANCH,"2nd year UG, 3rd year UG, 1st year MSc, 1st year Mtech, 1st year Ph.D",ML/AI enthusiast and Python,10,5th May to 14th July,We will be committing 25k-50K per student depending on the deliverables.,Bangalore,No,No,"1. Robust rating system which works across all major sports.
2. Models trained and fine tuned for drills across sports.",KhiladiPro is hosting major sporting challenges across sports and fitness. We heavily rely on Visual AI and ML. Entire team is comprised of IIT alumni. Students will get a lot of learning and handholding. Refer to our website for further details. https://www.khiladipro.com/team,Yes,Yes